{"canonicalization":"kvell-json-ascii-sorted-compact-lf-v1","format":"embed-labs.ethercat-device-adapter-authorization-policy-v1","formatVersion":1,"policyId":"embedlabs.adapter-authorization.production.api054","policyRevision":1,"revokedAuthorizationIds":[],"revokedSignerKeyIds":[],"rootKeyId":"b8afb54d449c673d5b8114e97bab73608135b1404d496e9c274e903bace2f698","signers":[{"adapterIds":["org.embedlabs.adapter.inovance.sv630n-1axis.rev00010000","org.embedlabs.adapter.solidot.xb6-ec0002.rev1"],"decisions":["allow"],"keyId":"017eec68600999eea588857f765c10e740327091ccf0fd9bde86236af3ac5783","publicKey":"8af4da94012289a2166f90aab18df974b169a198cce62dd959d8ae1ed627a69a"}]}
